{
  "projectContractVersion": "qaip-project-v1",
  "baseModel": {"schemaVersion":"0.1","project":{"id":"P-1","name":"Project"},"sources":[],"nodes":[{"id":"BR-1","type":"BUSINESS_RULE","name":"Rule 1","rule":{"code":"BR-1","ruleType":"BUSINESS_INVARIANT","text":"first"}},{"id":"BR-2","type":"BUSINESS_RULE","name":"Rule 2","rule":{"code":"BR-2","ruleType":"BUSINESS_INVARIANT","text":"second"}}],"relationships":[{"id":"REL-1","from":"BR-1","type":"DEPENDS_ON","to":"BR-2"}]},
  "declaredChanges": [{"artifactCategory":"NODE","canonicalIdentity":"BR-1","changeKind":"ADDED","schemaVersion":"0.1","afterState":{"id":"BR-1","type":"BUSINESS_RULE","name":"Rule 1","rule":{"code":"BR-1","ruleType":"BUSINESS_INVARIANT","text":"first"}}},{"artifactCategory":"RELATIONSHIP","canonicalIdentity":"REL-1","changeKind":"ADDED","schemaVersion":"0.1","afterState":{"id":"REL-1","from":"BR-1","type":"DEPENDS_ON","to":"BR-2"}}],
  "evidenceManifest": {"contractVersion":"impact-evidence-manifest-v1","sourceId":"jira","snapshot":{"sourceId":"jira","snapshotId":"snapshot-1","contentFingerprint":"sha256:snapshot"},"normalizationVersion":"impact-evidence-normalization-v1","canonicalizationVersion":"impact-evidence-canonical-v1","manifestFingerprint":"sha256:manifest","identityAssertions":[{"assertionId":"z-resolved","snapshot":{"sourceId":"jira","snapshotId":"snapshot-1","contentFingerprint":"sha256:snapshot"},"localArtifactId":"local-1","nodeType":"BUSINESS_RULE","resolution":{"status":"RESOLVED","canonicalIdentity":"BR-1"},"contentFingerprint":"sha256:a","provenanceId":"p-1"},{"assertionId":"a-unresolved","snapshot":{"sourceId":"jira","snapshotId":"snapshot-1","contentFingerprint":"sha256:snapshot"},"localArtifactId":"local-2","nodeType":"BUSINESS_RULE","resolution":{"status":"UNRESOLVED","reasonCode":"NO_MAPPING"},"contentFingerprint":"sha256:b","provenanceId":"p-1"}],"relationships":[{"datumId":"d-1","snapshot":{"sourceId":"jira","snapshotId":"snapshot-1","contentFingerprint":"sha256:snapshot"},"sourceLocalId":"local-1","targetLocalId":"local-2","relationshipType":"DEPENDS_ON","sourceNativeType":"blocks","normalizationVersion":"impact-evidence-normalization-v1","contentFingerprint":"sha256:r","provenanceId":"p-1"}],"provenance":[{"provenanceId":"p-1","originLocator":"jira://issue/1","originHash":"sha256:origin","normalizationActivity":"jira-mapping","normalizationVersion":"impact-evidence-normalization-v1"}]},
  "subject": {"localArtifactId":"local-1"},
  "analysisContext": {"qualificationVersion":"impact-evidence-qualification-v1","influenceVersion":"impact-evidence-business-rule-depends-on-v1","algorithmVersion":"impact-evidence-analysis-v1"}
}
