{
  "subject": {"localArtifactId":"local-2"},
  "analysisContext": {"qualificationVersion":"impact-evidence-qualification-v1","influenceVersion":"impact-evidence-business-rule-depends-on-v1","algorithmVersion":"impact-evidence-analysis-v1"},
  "evidenceManifest": {"contractVersion":"impact-evidence-manifest-v1","sourceId":"jira","snapshot":{"sourceId":"jira","snapshotId":"snapshot-1","contentFingerprint":"sha256:snapshot"},"normalizationVersion":"impact-evidence-normalization-v1","canonicalizationVersion":"impact-evidence-canonical-v1","manifestFingerprint":"sha256:manifest","identityAssertions":[{"assertionId":"z-last","snapshot":{"sourceId":"jira","snapshotId":"snapshot-1","contentFingerprint":"sha256:snapshot"},"localArtifactId":"local-2","nodeType":"BUSINESS_RULE","resolution":{"status":"UNRESOLVED","reasonCode":"NO_MAPPING"},"contentFingerprint":"sha256:z","provenanceId":"p-z"},{"assertionId":"a-first","snapshot":{"sourceId":"jira","snapshotId":"snapshot-1","contentFingerprint":"sha256:snapshot"},"localArtifactId":"local-1","nodeType":"BUSINESS_RULE","resolution":{"status":"RESOLVED","canonicalIdentity":"BR-1"},"contentFingerprint":"sha256:a","provenanceId":"p-a"}],"relationships":[],"provenance":[{"provenanceId":"p-z","originLocator":"jira://z","originHash":"sha256:z","normalizationActivity":"mapping","normalizationVersion":"impact-evidence-normalization-v1"},{"provenanceId":"p-a","originLocator":"jira://a","originHash":"sha256:a","normalizationActivity":"mapping","normalizationVersion":"impact-evidence-normalization-v1"}]},
  "declaredChanges": [{"artifactCategory":"RELATIONSHIP","canonicalIdentity":"REL-Z","changeKind":"ADDED","schemaVersion":"0.1","afterState":{"id":"REL-Z","from":"BR-1","type":"DEPENDS_ON","to":"BR-2"}},{"artifactCategory":"NODE","canonicalIdentity":"BR-A","changeKind":"ADDED","schemaVersion":"0.1","afterState":{"id":"BR-A","type":"BUSINESS_RULE","name":"Rule","rule":{"code":"BR-A","ruleType":"BUSINESS_INVARIANT","text":"rule"}}}],
  "baseModel": {"schemaVersion":"0.1","project":{"id":"P-1","name":"Project"},"sources":[],"nodes":[],"relationships":[]},
  "projectContractVersion": "qaip-project-v1"
}
